{
  "version": 1,
  "id": "PGM-CHAIN",
  "title": "Dispatch chain fixture",
  "status": "executing",
  "goal": "Exercise next-ready / blockers / unlocks-if-closed forward queries.",
  "story_refs": ["US-001"],
  "epics": [
    {
      "id": "EP-001",
      "title": "Sequential pipeline",
      "story_refs": ["US-001"],
      "ticket_refs": ["T-A", "T-B", "T-C", "T-D"]
    }
  ],
  "tickets": [
    {
      "id": "T-A",
      "epic_id": "EP-001",
      "title": "Foundation work",
      "type": "feature",
      "lifecycle": "done",
      "story_refs": ["US-001"],
      "defect_refs": [],
      "gap_refs": [],
      "depends_on": [],
      "acceptance_criteria": ["AC-A"],
      "child_plan": { "policy": "not_required", "plan_dir": null, "reason": "fixture" },
      "compatibility_contract_refs": [],
      "migration_boundary_refs": [],
      "deletion_move_census_refs": [],
      "verification_refs": ["VM-A"]
    },
    {
      "id": "T-B",
      "epic_id": "EP-001",
      "title": "Depends on A — should be next-ready",
      "type": "feature",
      "lifecycle": "ready",
      "story_refs": ["US-001"],
      "defect_refs": [],
      "gap_refs": [],
      "depends_on": ["T-A"],
      "acceptance_criteria": ["AC-B"],
      "child_plan": { "policy": "not_required", "plan_dir": null, "reason": "fixture" },
      "compatibility_contract_refs": [],
      "migration_boundary_refs": [],
      "deletion_move_census_refs": [],
      "verification_refs": ["VM-B"]
    },
    {
      "id": "T-C",
      "epic_id": "EP-001",
      "title": "Depends on B — blocked",
      "type": "feature",
      "lifecycle": "ready",
      "story_refs": ["US-001"],
      "defect_refs": [],
      "gap_refs": [],
      "depends_on": ["T-B"],
      "acceptance_criteria": ["AC-C"],
      "child_plan": { "policy": "not_required", "plan_dir": null, "reason": "fixture" },
      "compatibility_contract_refs": [],
      "migration_boundary_refs": [],
      "deletion_move_census_refs": [],
      "verification_refs": ["VM-C"]
    },
    {
      "id": "T-D",
      "epic_id": "EP-001",
      "title": "Independent — also next-ready",
      "type": "feature",
      "lifecycle": "ready",
      "story_refs": ["US-001"],
      "defect_refs": [],
      "gap_refs": [],
      "depends_on": [],
      "acceptance_criteria": ["AC-D"],
      "child_plan": { "policy": "not_required", "plan_dir": null, "reason": "fixture" },
      "compatibility_contract_refs": [],
      "migration_boundary_refs": [],
      "deletion_move_census_refs": [],
      "verification_refs": ["VM-D"]
    }
  ],
  "acceptance_criteria": [
    { "id": "AC-A", "scope": "ticket", "subject_ref": "T-A", "text": "A is done.", "story_refs": ["US-001"], "maintenance_rationale": null },
    { "id": "AC-B", "scope": "ticket", "subject_ref": "T-B", "text": "B is unblocked when A is done.", "story_refs": ["US-001"], "maintenance_rationale": null },
    { "id": "AC-C", "scope": "ticket", "subject_ref": "T-C", "text": "C unblocks when B is done.", "story_refs": ["US-001"], "maintenance_rationale": null },
    { "id": "AC-D", "scope": "ticket", "subject_ref": "T-D", "text": "D is independent.", "story_refs": ["US-001"], "maintenance_rationale": null }
  ],
  "dependencies": [],
  "compatibility_contracts": [],
  "migration_boundaries": [],
  "deletion_move_census": [],
  "verification_matrix": [
    { "id": "VM-A", "scope": "ticket", "subject_ref": "T-A", "acceptance_criterion_ref": "AC-A", "proof_type": "proof:artifact_review", "command_or_action": "review", "pass_means": "ok", "residual_risk": "none" },
    { "id": "VM-B", "scope": "ticket", "subject_ref": "T-B", "acceptance_criterion_ref": "AC-B", "proof_type": "proof:artifact_review", "command_or_action": "review", "pass_means": "ok", "residual_risk": "none" },
    { "id": "VM-C", "scope": "ticket", "subject_ref": "T-C", "acceptance_criterion_ref": "AC-C", "proof_type": "proof:artifact_review", "command_or_action": "review", "pass_means": "ok", "residual_risk": "none" },
    { "id": "VM-D", "scope": "ticket", "subject_ref": "T-D", "acceptance_criterion_ref": "AC-D", "proof_type": "proof:artifact_review", "command_or_action": "review", "pass_means": "ok", "residual_risk": "none" }
  ],
  "decisions": []
}
