{
  "version": 1,
  "id": "PGM-TEST",
  "title": "Program Close Missing Deferral Decision",
  "status": "closed",
  "goal": "Show program close deferral failure.",
  "story_refs": ["US-001"],
  "epics": [
    { "id": "EP-001", "title": "Close epic", "story_refs": ["US-001"], "ticket_refs": ["T-001"] }
  ],
  "tickets": [
    {
      "id": "T-001",
      "epic_id": "EP-001",
      "title": "Deferred ticket",
      "type": "feature",
      "lifecycle": "deferred",
      "story_refs": ["US-001"],
      "defect_refs": [],
      "gap_refs": [],
      "depends_on": [],
      "acceptance_criteria": ["AC-001"],
      "child_plan": { "policy": "not_required", "plan_dir": null, "reason": "Fixture" },
      "compatibility_contract_refs": [],
      "migration_boundary_refs": [],
      "deletion_move_census_refs": [],
      "verification_refs": ["VM-001"]
    }
  ],
  "acceptance_criteria": [
    { "id": "AC-001", "scope": "ticket", "subject_ref": "T-001", "text": "Deferred ticket has decision.", "story_refs": ["US-001"], "maintenance_rationale": null },
    { "id": "AC-PGM", "scope": "program", "subject_ref": "PGM-TEST", "text": "Program verification passes.", "story_refs": ["US-001"], "maintenance_rationale": null }
  ],
  "dependencies": [],
  "compatibility_contracts": [],
  "migration_boundaries": [],
  "deletion_move_census": [],
  "verification_matrix": [
    { "id": "VM-001", "scope": "ticket", "subject_ref": "T-001", "acceptance_criterion_ref": "AC-001", "proof_type": "proof:artifact_review", "command_or_action": "Review deferral", "pass_means": "Decision exists" },
    { "id": "VM-PGM", "scope": "program", "subject_ref": "PGM-TEST", "acceptance_criterion_ref": "AC-PGM", "proof_type": "proof:artifact_review", "command_or_action": "Review program close", "pass_means": "Program evidence passes", "result": "pass" }
  ],
  "decisions": []
}
